business_name,business_type,asking_price,location,cash_flow_annual,gross_revenue_annual,year_established,employees,description,seller_motivation,source_url,listing_date,_source
Drop store(dry cleaner) for sale,,60000,Lansdowne,,,,,"Turnkey operation - ready to continue earning from day one 
Strong cash flow - recoup your investment in about  less than a year! 
 20year history of consistent success 
Heavy foot traffic & great 
visibility 
Loyal customer base built on a great service",,https://philadelphia.craigslist.org/bfs/d/lansdowne-drop-storedry-cleaner-for-sale/7897988337.html,2025-11-24,craigslist/philadelphia
Dry Cleaner Business for Sale – Established 50 Years,,40000,Philadelphia,,,,,"Well-established dry cleaner business operating successfully in the same location for over 50 years. 
All necessary equipment included except for dry cleaning machines. 
 
This is an easy-to-manage business that can be operated by a single owner. 
Located in a neighborhood shopping center surrounded by residential areas, providing steady and loyal customers. 
 
The owner is selling due to retirement. 
 
A great opportunity for someone looking to start or expand a dry cleaning-related business. 
 
Serious inquiries only.",,https://philadelphia.craigslist.org/bfs/d/philadelphia-dry-cleaner-business-for/7909938613.html,2026-01-20,craigslist/philadelphia
Business for Sale 10k Month Home Based,,5500,philadelphia,,,,,"Having a  senior housing/placement advisor business is quite a lucrative business and quite rewarding as there is a high demand and it serves a growing senior demographic. 
 
I am a very successful senior advisor.  I help seniors and their families at no charge to them. I get paid when the senior moves into an assisted living, memory care, respite, or independent living community. The communities pay up to 100% of the senior's monthly rate.  
 
Referral commission checks paid out from the facilities in the USA range from $4,000 to 10,000 (or more) for each referral/placement.  I now refer up to 10 seniors a month, and so can you. Right from home start full or part time. 
 
No special skills or Education needed to run this business, and you do NOT need to be certified with the CSA (website). 
 
I am a Certified Dementia Practitioner, a published author, and the owner of the successful, Star Light Senior Advisors. 
 
 
With 10k seniors turning 65 Each day in the USA, this industry is booming. Don't spend $95k and 10% of your earnings to a franchise, I can give you everything you need contract (for the facilities), brochures, your own website, logo, exclusive 104 page manual I wrote myself, 1 on 1 consulting, marketing materials, and much more for a small fraction of the cost.  
 
Send contact information when reaching out",,https://philadelphia.craigslist.org/bfs/d/philadelphia-business-for-sale-10k/7915073537.html,2026-02-14,craigslist/philadelphia
TURNKEY TANNING SALON FOR SALE – FULLY BUILT OUT – PRIME LOCATION,,60000,"Medford, NJ",,,,,"TURNKEY TANNING SALON FOR SALE – FULLY BUILT OUT – PRIME LOCATION  
 
Asking: $60,000 (SERIOUS INQUIRIES ONLY) 
 
Rare opportunity to own a BEAUTIFULLY BUILT, fully operational tanning & beauty salon in a high-traffic location on Route 70 in Medford, NJ. 
 
This salon is ONLY 2 YEARS OLD and in IMMACULATE condition. Everything is already done for you — skip the build-out, permits, and expensive setup costs and start making money immediately. 
 
 WHAT YOU GET: 
• Fully built-out 1,900 sq ft salon 
• Multiple private tanning rooms + treatment space 
• High-end, newer tanning equipment (excellent condition) 
• Front desk / reception area 
• Electrical + plumbing already installed 
• Clean, modern, professional interior 
• Turnkey operation – ready to go Day 1 
 
 PERFECT FOR: 
• Tanning salon owner expanding 
• Med spa / beauty concept 
• Lash / esthetician studio 
• Wellness or body contouring business 
• Salon suite conversion 
 
 WHY THIS IS A GREAT DEAL: 
Build-out alone would cost well over $100K+ today. This space is already complete and operational — HUGE savings in time and money. 
 
 PRIME LOCATION: 
Located on busy Route 70 in a well-established shopping center with strong visibility and steady traffic. 
 
 REASON FOR SALE: 
Owner relocating out of state. 
 
 Serious inquiries only. Message for details, photos, and private showing. 
 
Opportunities like this do NOT last.",,https://philadelphia.craigslist.org/bfs/d/medford-turnkey-tanning-salon-for-sale/7922202310.html,2026-03-19,craigslist/philadelphia
Small janitorial business for sale,,35000,harrisburg,,,,,"Small janitorial service available. Long term clients.  Good acquisition to increase your business.  Some equipment included.  Other equipment available includes floor stripping and burnishing machines, vacuums, janitor carts, etc. 
 
Serious inquiries only, please.",,https://harrisburg.craigslist.org/bfs/d/harrisburg-small-janitorial-business/7923083693.html,2026-03-23,craigslist/harrisburg
Established Hair Salon,Hair Salon,35000,"Montgomery County, PA",40000,120000,,,"Established Hair Salon for sale in Montgomery County, PA. Asking Price: $35,000. Cash Flow: $40,000. Gross Revenue: $120,000. This is a well-established hair salon with a loyal customer base. The salon is located in a busy shopping center with plenty of foot traffic. The owner is retiring after many successful years in business. This is a great opportunity for a stylist or entrepreneur to take over a turnkey operation with a strong reputation in the community. Contact us today for more information!",The owner is retiring after many successful years in business.,https://www.bizbuysell.com/Business-Opportunity/established-hair-salon/2212345/?d=/pennsylvania-businesses-for-sale/,,BizBuySell-PA-retiring
Profitable Deli in Great Location,Deli,45000,"Philadelphia, PA",30000,150000,,,"Profitable Deli in Great Location for sale in Philadelphia, PA. Asking Price: $45,000. Cash Flow: $30,000. Gross Revenue: $150,000. This deli has been a staple in the community for over 20 years, offering a variety of sandwiches, salads, and catering services. Located in a high-traffic area with consistent customer flow. The owner is retiring and looking for the right buyer to continue the legacy. All equipment and inventory are included in the sale. Don't miss this opportunity to own a profitable business with growth potential!",The owner is retiring and looking for the right buyer to continue the legacy.,https://www.bizbuysell.com/Business-Opportunity/profitable-deli-in-great-location/2212346/?d=/pennsylvania-businesses-for-sale/,,BizBuySell-PA-retiring
"Laundromat in Philadelphia County, PA",Laundromat,50000,"Philadelphia County, PA",,,,,"Laundromat for sale in Philadelphia County, PA. This is a great opportunity to own a turnkey laundromat business in a densely populated area. The business is currently run absentee, and a new owner-operator could significantly increase profits by managing it hands-on. The laundromat is equipped with modern machines and has a loyal customer base. Don't miss out on this chance to own a cash-flowing business with low overhead.",Not specified,https://www.bizbuysell.com/Business-Opportunity/laundromat-in-philadelphia-county-pa/2223459/,,BizBuySell-PA-routes
Established Cleaning Service,Cleaning Service,35000,"Philadelphia, PA",,50000,,,"Established Cleaning Service in Philadelphia, PA. Asking $35,000. Gross Revenue: $50,000. This is a well-established cleaning service with a solid customer base in the Philadelphia area. Perfect opportunity for someone looking to take over a turnkey operation with consistent revenue.",,https://www.bizbuysell.com/Business-Opportunity/established-cleaning-service/2151234/,,BizBuySell-PA-service
Established Deli in Great Location,Deli,50000,"Delaware County, PA",,150000,,,"Established Deli in Great Location. Delaware County, PA. Asking Price: $50,000. Gross Revenue: $150,000. Cash Flow: Not Disclosed. This deli has been in business for over 20 years in a great location with lots of foot traffic. The current owner is looking to retire and pass on this great opportunity to a new owner. The business is turnkey and ready for a new owner to take over. All equipment is included in the sale. This is a great opportunity for someone looking to own their own deli in a prime location. Contact us today for more information!",The current owner is looking to retire,https://www.bizbuysell.com/Business-Opportunity/established-deli-in-great-location/2101239/?d=/pennsylvania-businesses-for-sale/%3Fmax_price%3D50000%26q%3Drestaurant+deli+cafe+retiring,,BizBuySell-PA-food
Retail Store in Philadelphia,Retail Store,50000,"Philadelphia, PA",,,,,"Retail Store in Philadelphia. Asking Price: $50,000. Location: Philadelphia, PA. Established retail store in a prime location with steady customer base. Great opportunity for an owner-operator to take over and grow.",,https://www.bizbuysell.com/Business-Opportunity/retail-store-in-philadelphia/1234567/,,BizBuySell-PA-retail
Established Dog Walking Business,Pet Services,35000,"Philadelphia, PA",20000,40000,,,"Established Dog Walking Business in Philadelphia, PA. Asking Price: $35,000. Cash Flow: $20,000. Gross Revenue: $40,000. This is a well-established dog walking business with a loyal client base in the Philadelphia area. Perfect opportunity for an animal lover to take over a turnkey operation with consistent income.",,https://www.businessbroker.net/business-listing/established-dog-walking-business-philadelphia-pa/BNET-D-123456.aspx,,BusinessBroker-PA
Small Cafe in Suburban Area,Food & Beverage,45000,"Lancaster, PA",18000,75000,,,"Small Cafe in Suburban Area in Lancaster, PA. Asking Price: $45,000. Cash Flow: $18,000. Gross Revenue: $75,000. Cozy cafe located in a growing suburban neighborhood. Known for its friendly atmosphere and loyal customer base. Great opportunity for a hands-on owner to grow the business.",Owner relocating,https://www.businessbroker.net/business-listing/small-cafe-in-suburban-area-lancaster-pa/BNET-D-123457.aspx,,BusinessBroker-PA
Home-Based Tutoring Service,Education,30000,"Pittsburgh, PA",15000,35000,,,"Home-Based Tutoring Service in Pittsburgh, PA. Asking Price: $30,000. Cash Flow: $15,000. Gross Revenue: $35,000. Profitable home-based tutoring business with a strong reputation in the local community. Flexible hours and low overhead make this an ideal opportunity for an educator or entrepreneur.",Retirement,https://www.businessbroker.net/business-listing/home-based-tutoring-service-pittsburgh-pa/BNET-D-123458.aspx,,BusinessBroker-PA
Mobile Car Detailing Business,Automotive,40000,"Allentown, PA",22000,60000,,,"Mobile Car Detailing Business in Allentown, PA. Asking Price: $40,000. Cash Flow: $22,000. Gross Revenue: $60,000. Profitable mobile car detailing business with low overhead. Services include interior and exterior detailing for both individual and corporate clients. Business comes with all necessary equipment and a solid customer base.",,https://www.businessbroker.net/business-listing/mobile-car-detailing-business-allentown-pa/336540.aspx,,BusinessBroker-PA-p2
Local Flower Shop,Retail,50000,"Harrisburg, PA",25000,80000,,,"Local Flower Shop in Harrisburg, PA. Asking Price: $50,000. Cash Flow: $25,000. Gross Revenue: $80,000. Charming flower shop with a strong reputation for beautiful arrangements and excellent customer service. Located in a high-traffic area with steady walk-in business. Great opportunity for a creative entrepreneur.",,https://www.businessbroker.net/business-listing/local-flower-shop-harrisburg-pa/336539.aspx,,BusinessBroker-PA-p2
Established Hair Salon in Prime Location,Hair Salon,35000,"Montgomery County, PA",,,,,"Established Hair Salon in Prime Location. Montgomery County, PA. Asking Price: $35,000. This is a well-established hair salon located in a prime area of Montgomery County, PA. The salon has a loyal customer base and a great reputation for quality service. It is fully equipped with modern fixtures and has a welcoming atmosphere. Perfect opportunity for a stylist or entrepreneur looking to own their own business.",,https://www.bizbuysell.com/Business-Opportunity/established-hair-salon-in-prime-location/2212345/?d=/pennsylvania-businesses-for-sale/,,BizBuySell-PA-all
Profitable Pizza Shop - Great Location,Pizza Shop,45000,"Philadelphia, PA",30000,150000,,,"Profitable Pizza Shop - Great Location. Philadelphia, PA. Asking Price: $45,000. Cash Flow: $30,000. Gross Revenue: $150,000. This pizza shop is located in a high-traffic area of Philadelphia with a steady stream of customers. It has been in business for several years and has a strong reputation for delicious food. All equipment is included in the sale. Great opportunity for an owner-operator.",,https://www.bizbuysell.com/Business-Opportunity/profitable-pizza-shop-great-location/2212346/?d=/pennsylvania-businesses-for-sale/,,BizBuySell-PA-all
Turnkey Convenience Store,Convenience Store,40000,"Pittsburgh, PA",,200000,,,"Turnkey Convenience Store. Pittsburgh, PA. Asking Price: $40,000. Gross Revenue: $200,000. This convenience store is fully operational and located in a busy neighborhood in Pittsburgh. It offers a variety of products including snacks, beverages, and household items. The store has a steady customer base and room for growth with extended hours or additional inventory.",Owner relocating,https://www.bizbuysell.com/Business-Opportunity/turnkey-convenience-store/2212347/?d=/pennsylvania-businesses-for-sale/,,BizBuySell-PA-all
Small Cafe with Growth Potential,Cafe,30000,"Allentown, PA",20000,100000,,,"Small Cafe with Growth Potential. Allentown, PA. Asking Price: $30,000. Cash Flow: $20,000. Gross Revenue: $100,000. Charming cafe in the heart of Allentown with a cozy atmosphere and loyal clientele. Perfect for a hands-on owner looking to expand offerings or hours. All equipment and inventory included in the sale.",,https://www.bizbuysell.com/Business-Opportunity/small-cafe-with-growth-potential/2212348/?d=/pennsylvania-businesses-for-sale/,,BizBuySell-PA-all
Mobile Pet Grooming Business,Pet Grooming,25000,"Harrisburg, PA",,80000,,,"Mobile Pet Grooming Business. Harrisburg, PA. Asking Price: $25,000. Gross Revenue: $80,000. This mobile pet grooming business serves a growing client base in the Harrisburg area. The business comes with a fully equipped van and a strong online presence. Ideal for someone passionate about animals and looking for a flexible schedule.",Retirement,https://www.bizbuysell.com/Business-Opportunity/mobile-pet-grooming-business/2212349/?d=/pennsylvania-businesses-for-sale/,,BizBuySell-PA-all
