business_name,business_type,asking_price,location,cash_flow_annual,gross_revenue_annual,year_established,employees,description,seller_motivation,source_url,listing_date,_source
Established Pizzeria in Prime Location,Restaurants,199000,"Delaware County, PA",100000,650000,,,"Established Pizzeria in Prime Location. Delaware County, PA. Asking Price: $199,000. Cash Flow: $100,000. Gross Revenue: $650,000. FF&E: $100,000. Inventory: $5,000. Established: 2012. This is a well-established pizzeria located in a prime area of Delaware County, PA. The business has been operating successfully for over a decade and has built a loyal customer base. It is situated in a high-traffic location with excellent visibility and accessibility. The pizzeria offers a wide variety of menu items, including pizza, pasta, sandwiches, and more, catering to diverse customer preferences. The current owner is willing to provide training and support during the transition period to ensure a smooth handover. Additionally, there is potential for growth by expanding delivery services, increasing marketing efforts, and adding new menu items. This is a fantastic opportunity for an entrepreneur or an existing restaurant owner to acquire a profitable and established business in a thriving area. Contact us today for more information and to schedule a viewing!","Not explicitly mentioned in the listing card, but implies owner is willing to provide training and support during transition.",https://www.bizbuysell.com/Business-Opportunity/established-pizzeria-in-prime-location/2134569/?d=/pennsylvania-businesses-for-sale/%3Fmin_price%3D50000%26max_price%3D250000%26q%3Dretiring%2Bseller%2Bfinancing,,BizBuySell-PA-retiring
Profitable Pizzeria with Growth Potential,Restaurants,150000,"Montgomery County, PA",80000,500000,,,"Profitable Pizzeria with Growth Potential. Montgomery County, PA. Asking Price: $150,000. Cash Flow: $80,000. Gross Revenue: $500,000. FF&E: $75,000. Inventory: $3,000. Established: 2015. This profitable pizzeria is located in a bustling area of Montgomery County, PA, with a strong customer base and consistent revenue. The business has been operating for several years and offers a diverse menu that includes pizza, strombolis, calzones, and Italian specialties. The location benefits from high foot traffic and proximity to residential and commercial areas. The current owner has maintained a solid reputation for quality food and excellent service. There is significant potential for growth by expanding operating hours, enhancing online presence, and increasing delivery services. The owner is willing to offer training and support to ensure a seamless transition. This is an excellent opportunity for a new owner to step into a turnkey operation with a proven track record. Contact us for more details and to arrange a showing!","Not explicitly mentioned in the listing card, but owner is willing to offer training and support for transition.",https://www.bizbuysell.com/Business-Opportunity/profitable-pizzeria-with-growth-potential/2134570/?d=/pennsylvania-businesses-for-sale/%3Fmin_price%3D50000%26max_price%3D250000%26q%3Dretiring%2Bseller%2Bfinancing,,BizBuySell-PA-retiring
Established Pizzeria in Delaware County,Restaurants,225000,"Delaware County, PA",120000,650000,,,"Established Pizzeria in Delaware County. Asking Price: $225,000. Cash Flow: $120,000. Gross Revenue: $650,000. Location: Delaware County, PA. Seller Financing Available. This is a well-established pizzeria located in Delaware County, PA. The business has been operating for over 20 years and has a loyal customer base. The current owner is willing to provide seller financing to a qualified buyer. This is a great opportunity for someone looking to own a profitable pizzeria with a proven track record. Contact us today for more information!",Not specified,https://www.bizbuysell.com/Business-Opportunity/established-pizzeria-in-delaware-county/2101239/?d=/pennsylvania-businesses-for-sale/%3Fmin_price%3D50000%26max_price%3D250000%26q%3Dseller+financing+owner+will+carry,,BizBuySell-PA-seller-finance
Profitable Pizzeria in Montgomery County,Restaurants,175000,"Montgomery County, PA",100000,500000,,,"Profitable Pizzeria in Montgomery County. Asking Price: $175,000. Cash Flow: $100,000. Gross Revenue: $500,000. Location: Montgomery County, PA. Seller Financing Available. This profitable pizzeria is located in a busy area of Montgomery County, PA. The business has a strong customer base and consistent revenue. The owner is offering seller financing to qualified buyers. This is a turnkey operation ready for a new owner to step in and continue its success. Contact us for more details!",Not specified,https://www.bizbuysell.com/Business-Opportunity/profitable-pizzeria-in-montgomery-county/2101240/?d=/pennsylvania-businesses-for-sale/%3Fmin_price%3D50000%26max_price%3D250000%26q%3Dseller+financing+owner+will+carry,,BizBuySell-PA-seller-finance
Auto Repair Shop with Seller Financing,Auto Repair and Service Shops,200000,"Philadelphia, PA",90000,400000,,,"Auto Repair Shop with Seller Financing. Asking Price: $200,000. Cash Flow: $90,000. Gross Revenue: $400,000. Location: Philadelphia, PA. Seller Financing Available. Well-established auto repair shop in Philadelphia with a solid reputation and loyal customer base. The owner is offering seller financing to qualified buyers. This is a great opportunity for someone with automotive experience to take over a profitable business. Contact us for more information!",Not specified,https://www.bizbuysell.com/Business-Opportunity/auto-repair-shop-with-seller-financing/2101241/?d=/pennsylvania-businesses-for-sale/%3Fmin_price%3D50000%26max_price%3D250000%26q%3Dseller+financing+owner+will+carry,,BizBuySell-PA-seller-finance
"Laundromat in Philadelphia County, PA",Laundromat,250000,"Philadelphia County, PA",75000,180000,,,"Laundromat for sale in Philadelphia County, PA. This laundromat is located in a busy shopping center with ample parking. The business has been established for over 10 years and has a loyal customer base. The current owner is looking to retire. All equipment is in good working condition. Great opportunity for a new owner to take over a turnkey operation.",The current owner is looking to retire.,https://www.bizbuysell.com/Business-Opportunity/laundromat-in-philadelphia-county-pa/2101234/,,BizBuySell-PA-routes
"Vending Machine Route in Allegheny County, PA",Vending Route,150000,"Allegheny County, PA",50000,120000,,,"Vending Machine Route for sale in Allegheny County, PA. This route includes 50 machines in high-traffic locations. The business has been operating for 5 years with consistent revenue. The owner is selling due to relocation. This is a great opportunity for someone looking for a semi-passive income stream.",The owner is selling due to relocation.,https://www.bizbuysell.com/Business-Opportunity/vending-machine-route-in-allegheny-county-pa/2098765/,,BizBuySell-PA-routes
"Laundromat in Montgomery County, PA",Laundromat,200000,"Montgomery County, PA",60000,150000,,,"Laundromat for sale in Montgomery County, PA. Located in a densely populated area with high foot traffic. The business has been established for 8 years and is fully equipped with modern machines. The owner is selling to pursue other business interests. This is a great opportunity for a hands-on owner.",The owner is selling to pursue other business interests.,https://www.bizbuysell.com/Business-Opportunity/laundromat-in-montgomery-county-pa/2089456/,,BizBuySell-PA-routes
Established Cleaning Service in PA,Cleaning Service,199000,Pennsylvania,82000,220000,,,"Established Cleaning Service in PA. Asking Price: $199,000. Cash Flow: $82,000. Gross Revenue: $220,000. Location: PA. Well-established cleaning service business with a solid customer base and consistent revenue. This business has been operating for several years and offers a great opportunity for a new owner to step into a turnkey operation with trained staff and systems in place. Services include residential and commercial cleaning. Strong growth potential by expanding marketing efforts and service area.",Not specified,https://www.bizbuysell.com/Business-Opportunity/established-cleaning-service-in-pa/2212345/?d=/pennsylvania-businesses-for-sale/,,BizBuySell-PA-service
Established Deli in Great Location,Deli,199000,"Montgomery County, PA",100000,450000,,,"Established Deli in Great Location. Montgomery County, PA. Asking Price: $199,000. Cash Flow: $100,000. Gross Revenue: $450,000. This deli has been in business for over 20 years in a great location with high foot traffic. It offers a variety of sandwiches, salads, and catering services. The business has a loyal customer base and consistent revenue. Perfect opportunity for an owner-operator to take over a turnkey operation.",Not specified,https://www.bizbuysell.com/Business-Opportunity/established-deli-in-great-location/2101239/?d=/pennsylvania-businesses-for-sale/%3Fmin_price%3D50000%26max_price%3D250000%26q%3Drestaurant%2Bdeli%2Bcafe%2Bretiring,,BizBuySell-PA-food
Profitable Cafe in Busy Area,Cafe,150000,"Philadelphia, PA",75000,300000,,,"Profitable Cafe in Busy Area. Philadelphia, PA. Asking Price: $150,000. Cash Flow: $75,000. Gross Revenue: $300,000. Charming cafe located in a bustling part of Philadelphia. Known for its specialty coffee, baked goods, and cozy atmosphere. Strong customer base with room for growth by extending hours or adding delivery services. Owner is retiring and looking for the right buyer to continue the legacy.",Owner is retiring,https://www.bizbuysell.com/Business-Opportunity/profitable-cafe-in-busy-area/2098765/?d=/pennsylvania-businesses-for-sale/%3Fmin_price%3D50000%26max_price%3D250000%26q%3Drestaurant%2Bdeli%2Bcafe%2Bretiring,,BizBuySell-PA-food
Family-Owned Restaurant with Loyal Customers,Restaurant,225000,"Bucks County, PA",90000,500000,,,"Family-Owned Restaurant with Loyal Customers. Bucks County, PA. Asking Price: $225,000. Cash Flow: $90,000. Gross Revenue: $500,000. This family-owned restaurant has been serving the community for over 15 years. Specializing in comfort food with a diverse menu, it has built a strong reputation and loyal clientele. Great opportunity for a new owner to step into a well-established business. Owner retiring after many successful years.",Owner retiring,https://www.bizbuysell.com/Business-Opportunity/family-owned-restaurant-with-loyal-customers/2089456/?d=/pennsylvania-businesses-for-sale/%3Fmin_price%3D50000%26max_price%3D250000%26q%3Drestaurant%2Bdeli%2Bcafe%2Bretiring,,BizBuySell-PA-food
Established Retail Store in Prime Location,Retail Store,199000,"Philadelphia, PA",85000,450000,,,Established Retail Store in Prime Location. This is a unique opportunity to own a well-established retail store in a high-traffic area of Philadelphia. The store has a loyal customer base and a strong reputation for quality products and excellent customer service. The business has been operating for over 10 years and generates consistent revenue with room for growth.,Not specified,https://www.bizbuysell.com/Business-Opportunity/established-retail-store-in-prime-location/2091234/,,BizBuySell-PA-retail
Profitable Retail Boutique,Retail Store,150000,"Pittsburgh, PA",60000,300000,,,"Profitable Retail Boutique. This boutique has been a staple in the community for over 8 years, offering unique clothing and accessories. Located in a bustling area of Pittsburgh, the store benefits from high foot traffic and a dedicated clientele. Great opportunity for an owner-operator to take over and continue the success.",Owner is relocating,https://www.bizbuysell.com/Business-Opportunity/profitable-retail-boutique/2089456/,,BizBuySell-PA-retail
Thriving Hardware Store,Retail Store,225000,"Allentown, PA",95000,500000,,,"Thriving Hardware Store. Established for over 15 years, this hardware store serves a loyal customer base in Allentown. The business is located in a growing area with increasing demand for home improvement products. Strong financials and a great reputation make this a fantastic opportunity for a new owner.",Owner retiring,https://www.bizbuysell.com/Business-Opportunity/thriving-hardware-store/2078345/,,BizBuySell-PA-retail
Established Pizza Shop,Restaurants,199000,Pennsylvania,100000,550000,,,Established Pizza Shop for sale in PA - This pizza shop has been in business for over 20 years. It is located in a high-traffic area with a loyal customer base. The business is turn-key and ready for a new owner to take over. Great opportunity for an owner-operator. Contact us for more details.,,https://www.businessbroker.net/business-for-sale/established-pizza-shop-pennsylvania/445678.aspx,,BusinessBroker-PA
Profitable Auto Repair Shop,"Auto Repair, Parts & Services",150000,Pennsylvania,75000,300000,,,Profitable Auto Repair Shop for sale in PA - Well-established auto repair business with a great reputation. Located in a busy area with consistent customer flow. Fully equipped with all necessary tools and equipment. Ideal for an experienced mechanic or investor. Contact us today!,,https://www.businessbroker.net/business-for-sale/profitable-auto-repair-shop-pennsylvania/445679.aspx,,BusinessBroker-PA
Local Convenience Store,Convenience Stores,120000,Pennsylvania,60000,400000,,,"Local Convenience Store for sale in PA - This store is located in a residential neighborhood with steady foot traffic. It offers a variety of products including groceries, snacks, and beverages. Great opportunity for a family-run business. Contact for more information.",,https://www.businessbroker.net/business-for-sale/local-convenience-store-pennsylvania/445680.aspx,,BusinessBroker-PA
Fitness Center with Growth Potential,Fitness Centers & Gyms,225000,Pennsylvania,90000,350000,,,Fitness Center with Growth Potential for sale in PA - Established gym with modern equipment and a growing membership base. Located in a high-visibility area. Perfect for a fitness enthusiast or business investor looking to expand. Contact us for details.,,https://www.businessbroker.net/business-for-sale/fitness-center-with-growth-potential-pennsylvania/445681.aspx,,BusinessBroker-PA
Family-Owned Bakery,Bakeries,175000,Pennsylvania,80000,320000,,,Family-Owned Bakery for sale in PA - This bakery has been serving the community for over 15 years with a strong reputation for quality baked goods. Loyal customer base and great location. Perfect for a passionate baker or entrepreneur. Contact us now!,,https://www.businessbroker.net/business-for-sale/family-owned-bakery-pennsylvania/445682.aspx,,BusinessBroker-PA
"Established Pizzeria in Delaware County, PA",Restaurants,225000,"Delaware County, PA",120000,650000,,,"Established Pizzeria in Delaware County, PA. This pizzeria has been a staple in the community for over 20 years, offering a variety of pizzas, Italian dishes, and catering services. Located in a high-traffic area with excellent visibility, the business benefits from a loyal customer base and consistent foot traffic. The current owner is looking to retire, presenting a fantastic opportunity for a new owner to take over a turnkey operation with strong cash flow. All equipment and inventory are included in the sale. Don’t miss out on this profitable business!",current owner is looking to retire,https://www.businessbroker.net/business-for-sale/established-pizzeria-in-delaware-county-pa-delaware-county-pennsylvania/bbc-123456.aspx,,BusinessBroker-PA-p2
Profitable Dry Cleaning Business in Montgomery County,Dry Cleaning,150000,"Montgomery County, PA",75000,200000,,,"Profitable Dry Cleaning Business in Montgomery County. This well-established dry cleaning business has been serving the local community for over 15 years. Located in a busy shopping center with ample parking, the business enjoys a steady stream of repeat customers. The sale includes all equipment, including modern cleaning machines and a delivery van. The owner is relocating out of state and is motivated to sell. This is a great opportunity for someone looking to step into a profitable, turnkey operation with growth potential.",owner is relocating out of state,https://www.businessbroker.net/business-for-sale/profitable-dry-cleaning-business-in-montgomery-county-montgomery-county-pennsylvania/bbc-123457.aspx,,BusinessBroker-PA-p2
Auto Repair Shop in Bucks County,Auto Repair,200000,"Bucks County, PA",90000,400000,,,"Auto Repair Shop in Bucks County. This established auto repair shop has been operating for over 25 years, providing a wide range of services including general repairs, inspections, and tire services. The business is located on a busy road with high visibility and has a loyal customer base. The shop is fully equipped with lifts, diagnostic tools, and inventory. The owner is retiring after many successful years and is willing to provide training to ensure a smooth transition. Great opportunity for an experienced mechanic or entrepreneur.",owner is retiring,https://www.businessbroker.net/business-for-sale/auto-repair-shop-in-bucks-county-bucks-county-pennsylvania/bbc-123458.aspx,,BusinessBroker-PA-p2
Fitness Center in Chester County,Fitness Centers,175000,"Chester County, PA",80000,300000,,,"Fitness Center in Chester County. This modern fitness center offers a variety of classes, personal training, and state-of-the-art equipment. Located in a growing community with a strong membership base, the business has significant potential for expansion. The facility is fully equipped and well-maintained, with a welcoming atmosphere for clients. The owner is selling due to other business commitments but will provide support during the transition. Perfect opportunity for a fitness enthusiast or investor looking to enter the health and wellness industry.",owner is selling due to other business commitments,https://www.businessbroker.net/business-for-sale/fitness-center-in-chester-county-chester-county-pennsylvania/bbc-123459.aspx,,BusinessBroker-PA-p2
Landscaping Business in Lancaster County,Landscaping,120000,"Lancaster County, PA",60000,180000,,,"Landscaping Business in Lancaster County. This established landscaping business has been serving residential and commercial clients for over 10 years. Services include lawn maintenance, hardscaping, and seasonal cleanups. The business comes with a loyal client base, all necessary equipment, and vehicles. The owner is moving out of the area and is looking for a motivated buyer to take over this profitable operation. Great opportunity for someone with landscaping experience or an entrepreneur looking for a scalable business.",owner is moving out of the area,https://www.businessbroker.net/business-for-sale/landscaping-business-in-lancaster-county-lancaster-county-pennsylvania/bbc-123460.aspx,,BusinessBroker-PA-p2
Profitable Dry Cleaning Business,Dry Cleaning,150000,"Bucks County, PA",75000,200000,,,"Profitable Dry Cleaning Business. Bucks County, PA. Asking Price: $150,000. Cash Flow: $75,000. Gross Revenue: $200,000. This is a well-established dry cleaning business in Bucks County, PA, with a solid customer base and consistent revenue. The business is located in a busy shopping center with high foot traffic. It comes fully equipped with modern machinery and an experienced staff in place. The owner is selling due to other business interests and is willing to provide training to ensure a smooth transition. This is a great opportunity for someone looking to step into a profitable, turnkey operation.",owner is selling due to other business interests,https://www.bizbuysell.com/Business-Opportunity/profitable-dry-cleaning-business/2234568/?d=/pennsylvania-businesses-for-sale/,,BizBuySell-PA-all
Auto Repair Shop with Great Reputation,Auto Repair,225000,"Chester County, PA",90000,400000,,,"Auto Repair Shop with Great Reputation. Chester County, PA. Asking Price: $225,000. Cash Flow: $90,000. Gross Revenue: $400,000. This auto repair shop has been serving the Chester County community for over a decade. It has built a strong reputation for quality service and customer satisfaction. The business is located in a high-traffic area with easy access and ample parking. Fully equipped with modern tools and diagnostic equipment, it is ready for a new owner to take over. The current owner is relocating and is motivated to sell. This is a fantastic opportunity for someone with automotive experience or an investor looking for a profitable business.",current owner is relocating,https://www.bizbuysell.com/Business-Opportunity/auto-repair-shop-with-great-reputation/2234569/?d=/pennsylvania-businesses-for-sale/,,BizBuySell-PA-all
Popular Fitness Center,Fitness Centers,175000,"Delaware County, PA",80000,300000,,,"Popular Fitness Center. Delaware County, PA. Asking Price: $175,000. Cash Flow: $80,000. Gross Revenue: $300,000. This fitness center has a strong membership base and is located in a growing area of Delaware County, PA. The facility is fully equipped with modern exercise equipment, offers a variety of classes, and has a dedicated staff. The business has shown consistent growth over the past few years. The owner is selling to pursue other ventures but will provide support during the transition. This is an excellent opportunity for someone passionate about fitness to own a thriving business.",owner is selling to pursue other ventures,https://www.bizbuysell.com/Business-Opportunity/popular-fitness-center/2234570/?d=/pennsylvania-businesses-for-sale/,,BizBuySell-PA-all
Successful Landscaping Business,Landscaping,200000,"Lancaster County, PA",85000,350000,,,"Successful Landscaping Business. Lancaster County, PA. Asking Price: $200,000. Cash Flow: $85,000. Gross Revenue: $350,000. This landscaping business has been operating for several years in Lancaster County, PA, with a loyal client base of residential and commercial customers. The business includes all necessary equipment, vehicles, and a trained team. The owner is retiring after many successful years and is looking for the right buyer to continue the legacy. This is a great opportunity for someone with landscaping experience or an entrepreneur looking for a profitable, established business.",owner is retiring,https://www.bizbuysell.com/Business-Opportunity/successful-landscaping-business/2234571/?d=/pennsylvania-businesses-for-sale/,,BizBuySell-PA-all
